### ISSUE TITLE
error writing to a directory, the hs no longer synchronizes with the blockhain.

### ISSUE THREAD

**Issue by koalabang** [NebraLtd/helium-miner-software#106]
Since July 24, I have encountered a problem on one of my HS. He can no longer synchronize with blochain. Looking at the network traffic we observe TCP RST packets sent every 2 mins on communications with the blockchain. 

19:40:41.318513 IP 18.213.70.164.443 > 192.168.1.51.57740: Flags [R], seq 1386264293, win 0, length 0
19:41:25.450593 IP 108.184.231.203.44237 > 192.168.1.51.44158: Flags [R], seq 4144492829, win 0, length 0
19:41:38.092816 IP 108.184.231.203.44158 > 192.168.1.51.36995: Flags [R], seq 3643933, win 0, length 0
19:41:38.099914 IP 108.184.231.203.44158 > 192.168.1.51.36995: Flags [R], seq 3643933, win 0, length 0
19:41:38.100178 IP 108.184.231.203.44158 > 192.168.1.51.36995: Flags [R], seq 3643933, win 0, length 0
19:41:38.100416 IP 108.184.231.203.44158 > 192.168.1.51.36995: Flags [R], seq 3643933, win 0, length 0
19:41:38.172395 IP 108.184.231.203.44158 > 192.168.1.51.36995: Flags [R], seq 3643933, win 0, length 0
19:41:40.171250 IP 192.168.1.51.36955 > 151.101.122.133.443: Flags [R], seq 212355067, win 0, length 0
19:41:40.171775 IP 192.168.1.51.36955 > 151.101.122.133.443: Flags [R], seq 212355067, win 0, length 0
19:41:45.972294 IP 192.168.1.51.57756 > 18.213.70.164.443: Flags [R], seq 1006029916, win 0, length 0
19:41:45.972348 IP 192.168.1.51.57756 > 18.213.70.164.443: Flags [R], seq 1006029916, win 0, length 0
19:41:46.131787 IP 18.213.70.164.443 > 192.168.1.51.57756: Flags [R], seq 2442953464, win 0, length 0
19:41:46.211746 IP 18.213.70.164.443 > 192.168.1.51.57756: Flags [R], seq 2442953464, win 0, length 0
19:41:49.202580 IP 192.168.1.51.57760 > 18.213.70.164.443: Flags [R], seq 2357592390, win 0, length 0
19:41:49.202886 IP 192.168.1.51.57760 > 18.213.70.164.443: Flags [R], seq 2357592390, win 0, length 0
19:41:49.394012 IP 18.213.70.164.443 > 192.168.1.51.57760: Flags [R], seq 463090684, win 0, length 0
19:41:49.394298 IP 192.168.1.51.57756 > 18.213.70.164.443: Flags [R], seq 1006029916, win 0, length 0
19:42:05.531987 IP 35.166.211.46.2154 > 192.168.1.51.44657: Flags [R.], seq 0, ack 2743434177, win 0, length 0
19:42:34.687733 IP 135.180.198.255.35025 > 192.168.1.51.44158: Flags [R], seq 2373430884, win 0, length 0
19:42:47.005100 IP 192.168.1.51.44158 > 86.91.102.251.1024: Flags [R.], seq 1134265387, ack 137463222, win 504, options [nop,nop,TS val 2888192168 ecr 996753294], length 0
19:42:47.288961 IP 192.168.1.51.45473 > 151.101.122.133.443: Flags [R], seq 262027931, win 0, length 0
19:42:47.289657 IP 192.168.1.51.45473 > 151.101.122.133.443: Flags [R], seq 262027931, win 0, length 0
19:42:50.593900 IP 192.168.1.51.34008 > 151.101.122.133.443: Flags [R], seq 1809348608, win 0, length 0
19:42:50.594064 IP 192.168.1.51.34008 > 151.101.122.133.443: Flags [R], seq 1809348608, win 0, length 0
19:42:53.048972 IP 192.168.1.51.56956 > 52.55.60.119.443: Flags [R], seq 571888323, win 0, length 0
19:42:53.049026 IP 192.168.1.51.56956 > 52.55.60.119.443: Flags [R], seq 571888323, win 0, length 0
19:42:53.209200 IP 52.55.60.119.443 > 192.168.1.51.56956: Flags [R], seq 3503418488, win 0, length 0
19:42:53.289189 IP 52.55.60.119.443 > 192.168.1.51.56956: Flags [R], seq 3503418488, win 0, length 0
19:42:55.889183 IP 192.168.1.51.50338 > 18.208.44.123.443: Flags [R], seq 3310863611, win 0, length 0
19:42:55.889236 IP 192.168.1.51.50338 > 18.208.44.123.443: Flags [R], seq 3310863611, win 0, length 0
19:42:56.168666 IP 18.208.44.123.443 > 192.168.1.51.50338: Flags [R], seq 2148210163, win 0, length 0
19:42:56.168948 IP 18.208.44.123.443 > 192.168.1.51.50338: Flags [R], seq 2148210163, win 0, length 0
19:43:39.044871 IP 72.68.205.101.55970 > 192.168.1.51.44158: Flags [R], seq 1172483127, win 0, length 0
19:43:39.046499 IP 72.68.205.101.55970 > 192.168.1.51.44158: Flags [R], seq 1172483127, win 0, length 0
19:43:58.287642 IP 192.168.1.51.47257 > 151.101.122.133.443: Flags [R], seq 865035366, win 0, length 0
19:43:58.287886 IP 192.168.1.51.47257 > 151.101.122.133.443: Flags [R], seq 865035366, win 0, length 0
19:43:59.006173 IP 72.68.205.101.44158 > 192.168.1.51.44158: Flags [R], seq 4245902699, win 0, length 0
19:44:02.631081 IP 18.208.44.123.443 > 192.168.1.51.50338: Flags [R], seq 2148210163, win 0, length 0
19:44:02.631245 IP 192.168.1.51.57794 > 18.213.70.164.443: Flags [R], seq 505188380, win 0, length 0
19:44:02.796572 IP 18.213.70.164.443 > 192.168.1.51.57794: Flags [R], seq 1701204746, win 0, length 0
19:44:02.870484 IP 18.213.70.164.443 > 192.168.1.51.57794: Flags [R], seq 1701204746, win 0, length 0
19:44:05.974033 IP 52.55.60.119.443 > 192.168.1.51.56978: Flags [R], seq 1866056928, win 0, length 0
19:44:05.974324 IP 52.55.60.119.443 > 192.168.1.51.56978: Flags [R], seq 1866056928, win 0, length 0
19:44:21.285924 IP 54.151.205.188.2154 > 192.168.1.51.32993: Flags [R.], seq 0, ack 1998060058, win 0, length 0
19:44:47.201957 IP 44.238.156.97.43291 > 192.168.1.51.44158: Flags [R], seq 1249905443, win 0, length 0
19:44:57.843679 IP 3.37.164.87.2154 > 192.168.1.51.34207: Flags [R.], seq 2936722932, ack 4107201980, win 481, options [nop,nop,TS val 3904255432 ecr 191775594], length 0
19:45:04.563267 IP 3.37.164.87.2154 > 192.168.1.51.44158: Flags [R.], seq 0, ack 2759823904, win 0, length 0
19:45:10.610853 IP 192.168.1.51.44158 > 188.40.163.0.2154: Flags [R.], seq 1147030392, ack 3931286515, win 501, options [nop,nop,TS val 699544723 ecr 2263122674], length 0
19:45:10.644493 IP 192.168.1.51.44158 > 188.40.163.0.2154: Flags [R], seq 1147030392, win 0, length 0
19:45:10.804476 IP 192.168.1.51.35863 > 151.101.122.133.443: Flags [R], seq 463809976, win 0, length 0
19:45:10.804530 IP 192.168.1.51.35863 > 151.101.122.133.443: Flags [R], seq 463809976, win 0, length 0
19:45:14.403512 IP 192.168.1.51.34046 > 151.101.122.133.443: Flags [R], seq 4001269886, win 0, length 0
19:45:14.403566 IP 192.168.1.51.34046 > 151.101.122.133.443: Flags [R], seq 4001269886, win 0, length 0
19:45:16.727262 IP 192.168.1.51.50370 > 18.208.44.123.443: Flags [R.], seq 2887698630, ack 2217672850, win 501, options [nop,nop,TS val 61455809 ecr 1178922388], length 0
19:45:16.882671 IP 18.208.44.123.443 > 192.168.1.51.50370: Flags [R], seq 2217672850, win 0, length 0
19:45:16.962614 IP 18.208.44.123.443 > 192.168.1.51.50370: Flags [R], seq 2217672850, win 0, length 0
19:45:20.003068 IP 192.168.1.51.56998 > 52.55.60.119.443: Flags [R], seq 2305923495, win 0, length 0
19:45:20.003226 IP 192.168.1.51.56998 > 52.55.60.119.443: Flags [R], seq 2305923495, win 0, length 0
19:45:20.162507 IP 52.55.60.119.443 > 192.168.1.51.56998: Flags [R], seq 2839715076, win 0, length 0
19:45:20.246766 IP 52.55.60.119.443 > 192.168.1.51.56998: Flags [R], seq 2839715076, win 0, length 0
19:45:21.924337 IP 192.168.1.51.44158 > 104.232.122.34.44158: Flags [R.], seq 0, ack 3303437651, win 0, length 0
19:45:35.722503 IP 35.166.211.46.2154 > 192.168.1.51.43177: Flags [R.], seq 0, ack 4082774780, win 0, length 0

Following this observation I obtained the logs from my HS to try to correlate the reset packets and the logs.

We observe in the logs a helium-miner process which is restarted every 2 minutes because there is a problem accessing the file "/var/data/blockchain_swarm/cache.dets".
Extracts from the log:
04.08.21 13:38:54 (+0200) <helium-miner> Connecting to helium-assets.nebra.com (172.67.13.199:443)
04.08.21 13:38:54 (+0200) Restarting service 'helium-miner sha256:ce3db3373450d1317bc1d43025cba0dc60424d818de866172a145e2323297f38'
04.08.21 13:38:55 (+0200) <helium-miner> saving to '/opt/miner/releases/0.1.0/sys.config'
04.08.21 13:38:55 (+0200) <helium-miner>
sys.config           100% |********************************|   657  0:00:00 ETA
04.08.21 13:38:55 (+0200) <helium-miner> '/opt/miner/releases/0.1.0/sys.config' saved
04.08.21 13:39:04 (+0200) <helium-miner> Exec: /usr/local/lib/erlang/erts-10.7.1/bin/erlexec -noinput +Bd -boot /opt/miner/releases/0.1.0/start -mode embedded -boot_var SYSTEM_LIB_DIR /usr/local/lib/erlang/lib -config /opt/miner/releases/0.1.0/sys.config -args_file /opt/miner/releases/0.1.0/vm.args -- foreground
04.08.21 13:39:04 (+0200) <helium-miner> Root: /opt/miner
04.08.21 13:39:04 (+0200) <helium-miner> /opt/miner
**04.08.21 13:39:14 (+0200) <helium-miner> dets: file "/var/data/blockchain_swarm/cache.dets" not properly closed, repairing ...
04.08.21 13:40:09 (+0200) <helium-miner> Killed**

I shared this log with a helium developer who advises to delete the blockchain_swarm directory. This directory will be rebuilt when the helium reminer service is launched.
There may be a problem with the flash memory.
I sent the workaround via the support but it's been 3 days that I wait for the manipulation to be done on my HS.
Can you generalize a detection of this type of error message and act with the erasure of the directory?

**Comment by vpetersson** [comment]
Ping @robputt here as you are likely interested in this.

**Comment by shawaj** [comment]
This is a known issue, however it should have been fixed in a recent update by helium.

https://github.com/helium/miner/issues/792
https://engineering.helium.com/2021/07/13/blockchain-release-snapshot-fixes.html

What firmware version does your hotspot say it is running on the local diagnostics page?

Have you got a ticket number as well for the email support ticket?

**Comment by koalabang** [comment]
Hello, I just watched the helium fix
The fix does not work on my HS, maybe the error message returned by the HS is not taken into account by the fix.
You can look in the logs of my HS by filtering on <helium-miner>, every 2 minutes it is sent <helium-miner> dets: file "/var/data/blockchain_swarm/cache.dets" not properly closed, repairing ...


  The hotspot at version 2021.08.02.1, the ticket number is ID # 257143.
The HS has been in the same condition for 14 days.

Thank you

**Comment by shawaj** [comment]
https://pisupply.freshdesk.com/a/tickets/257143

**Comment by koalabang** [comment]
What's new under the sun ? the ticket has been open for more than 10 days
without progress on the resolution. The problem is clearly identified, and
the helium update mentioned above does not work for this use case.
Thanks

**Comment by shawaj** [comment]
I am looking at it now. But it helps to put our ticket link here for reference. It helps us to keep the context for all discussions :-)

I'm just doing a factory reset on the device. Hopefully that should fix it but I'll let you know 👍

**Comment by koalabang** [comment]
OK, thanks. To be continued

**Comment by shawaj** [comment]
it looks like it is syncing ok now, but i will keep an eye on it until it is synced, may take a few hours :-)

**Comment by shawaj** [comment]
Looks all good now https://explorer.helium.com/hotspots/11RRgLVeh7eigMp8wurCn4pCjfxhfk5iFz4CioP3MuYfmCapbv8/activity

**Comment by chmichael** [comment]
Can you please add some kind of Factory reset without waiting Nebra to do it and waiting for days/weeks ?

Thank you
